[
  {
    "id": "0841cae9-3bf7-5ae4-95b7-470d7b1c7d98",
    "country_iso": "US",
    "topic": "American Government",
    "subtopic": "A: Principles of American Government",
    "language": "en",
    "front": "What is the form of government of the United States?",
    "back": "Republic; Constitution-based federal republic; Representative democracy",
    "source": {
      "url": "https://www.uscis.gov/sites/default/files/document/questions-and-answers/2025-Civics-Test-128-Questions-and-Answers.pdf",
      "section_or_page": "Question 1, page 2"
    },
    "needs_freshness_check": false
  },
  {
    "id": "0afde868-593d-5a9c-993e-f794de0a7d5a",
    "country_iso": "US",
    "topic": "American Government",
    "subtopic": "A: Principles of American Government",
    "language": "en",
    "front": "What is the supreme law of the land?",
    "back": "(U.S.) Constitution",
    "source": {
      "url": "https://www.uscis.gov/sites/default/files/document/questions-and-answers/2025-Civics-Test-128-Questions-and-Answers.pdf",
      "section_or_page": "Question 2, page 2"
    },
    "needs_freshness_check": false
  },
  {
    "id": "7c5597d7-969f-5295-a6e9-5dd3421b09d7",
    "country_iso": "US",
    "topic": "American Government",
    "subtopic": "A: Principles of American Government",
    "language": "en",
    "front": "Name one thing the U.S. Constitution does.",
    "back": "Forms the government; Defines powers of government; Defines the parts of government (any one of 4 accepted answers)",
    "source": {
      "url": "https://www.uscis.gov/sites/default/files/document/questions-and-answers/2025-Civics-Test-128-Questions-and-Answers.pdf",
      "section_or_page": "Question 3, page 2"
    },
    "needs_freshness_check": false
  },
  {
    "id": "fc20da47-edcd-5c49-a477-7b2333cc2ac6",
    "country_iso": "US",
    "topic": "American Government",
    "subtopic": "A: Principles of American Government",
    "language": "en",
    "front": "The U.S. Constitution starts with the words “We the People.” What does “We the People” mean?",
    "back": "Self-government; Popular sovereignty; Consent of the governed (any one of 5 accepted answers)",
    "source": {
      "url": "https://www.uscis.gov/sites/default/files/document/questions-and-answers/2025-Civics-Test-128-Questions-and-Answers.pdf",
      "section_or_page": "Question 4, page 2"
    },
    "needs_freshness_check": false
  },
  {
    "id": "56c30581-c000-5e97-9197-37345a3e93a6",
    "country_iso": "US",
    "topic": "American Government",
    "subtopic": "A: Principles of American Government",
    "language": "en",
    "front": "How are changes made to the U.S. Constitution?",
    "back": "Amendments; The amendment process",
    "source": {
      "url": "https://www.uscis.gov/sites/default/files/document/questions-and-answers/2025-Civics-Test-128-Questions-and-Answers.pdf",
      "section_or_page": "Question 5, page 2"
    },
    "needs_freshness_check": false
  },
  {
    "id": "0a1934f8-4aba-5a91-b703-522d92ec7848",
    "country_iso": "US",
    "topic": "American Government",
    "subtopic": "A: Principles of American Government",
    "language": "en",
    "front": "What does the Bill of Rights protect?",
    "back": "(The basic) rights of Americans; (The basic) rights of people living in the United States",
    "source": {
      "url": "https://www.uscis.gov/sites/default/files/document/questions-and-answers/2025-Civics-Test-128-Questions-and-Answers.pdf",
      "section_or_page": "Question 6, page 2"
    },
    "needs_freshness_check": false
  },
  {
    "id": "c99f5cdf-ae23-5e45-bfdb-6ff7576e53ba",
    "country_iso": "US",
    "topic": "American Government",
    "subtopic": "A: Principles of American Government",
    "language": "en",
    "front": "How many amendments does the U.S. Constitution have?",
    "back": "Twenty-seven (27)",
    "source": {
      "url": "https://www.uscis.gov/sites/default/files/document/questions-and-answers/2025-Civics-Test-128-Questions-and-Answers.pdf",
      "section_or_page": "Question 7, page 2"
    },
    "needs_freshness_check": false
  },
  {
    "id": "90b86c88-f3e9-5b17-9441-04887d5b8ea8",
    "country_iso": "US",
    "topic": "American Government",
    "subtopic": "A: Principles of American Government",
    "language": "en",
    "front": "Why is the Declaration of Independence important?",
    "back": "It says America is free from British control.; It says all people are created equal.; It identifies inherent rights. (any one of 4 accepted answers)",
    "source": {
      "url": "https://www.uscis.gov/sites/default/files/document/questions-and-answers/2025-Civics-Test-128-Questions-and-Answers.pdf",
      "section_or_page": "Question 8, page 2"
    },
    "needs_freshness_check": false
  },
  {
    "id": "c5f6c50c-c861-571a-b57c-d6f7e1027971",
    "country_iso": "US",
    "topic": "American Government",
    "subtopic": "A: Principles of American Government",
    "language": "en",
    "front": "What founding document said the American colonies were free from Britain?",
    "back": "Declaration of Independence",
    "source": {
      "url": "https://www.uscis.gov/sites/default/files/document/questions-and-answers/2025-Civics-Test-128-Questions-and-Answers.pdf",
      "section_or_page": "Question 9, page 3"
    },
    "needs_freshness_check": false
  },
  {
    "id": "1fe2771d-b88f-55dc-9773-ccbf0e44f2eb",
    "country_iso": "US",
    "topic": "American Government",
    "subtopic": "A: Principles of American Government",
    "language": "en",
    "front": "Name two important ideas from the Declaration of Independence and the U.S. Constitution.",
    "back": "Equality; Liberty; Social contract (any one of 6 accepted answers)",
    "source": {
      "url": "https://www.uscis.gov/sites/default/files/document/questions-and-answers/2025-Civics-Test-128-Questions-and-Answers.pdf",
      "section_or_page": "Question 10, page 3"
    },
    "needs_freshness_check": false
  },
  {
    "id": "598b49b3-d414-5481-841d-e2b68bf7a2d9",
    "country_iso": "US",
    "topic": "American Government",
    "subtopic": "A: Principles of American Government",
    "language": "en",
    "front": "The words “Life, Liberty, and the pursuit of Happiness” are in what founding document?",
    "back": "Declaration of Independence",
    "source": {
      "url": "https://www.uscis.gov/sites/default/files/document/questions-and-answers/2025-Civics-Test-128-Questions-and-Answers.pdf",
      "section_or_page": "Question 11, page 3"
    },
    "needs_freshness_check": false
  },
  {
    "id": "1689621b-765f-5e49-bfe3-61d11b0e3513",
    "country_iso": "US",
    "topic": "American Government",
    "subtopic": "A: Principles of American Government",
    "language": "en",
    "front": "What is the economic system of the United States?",
    "back": "Capitalism; Free market economy",
    "source": {
      "url": "https://www.uscis.gov/sites/default/files/document/questions-and-answers/2025-Civics-Test-128-Questions-and-Answers.pdf",
      "section_or_page": "Question 12, page 3"
    },
    "needs_freshness_check": false
  },
  {
    "id": "012be2c1-edc4-532b-9432-bc499a628a05",
    "country_iso": "US",
    "topic": "American Government",
    "subtopic": "A: Principles of American Government",
    "language": "en",
    "front": "What is the rule of law?",
    "back": "Everyone must follow the law.; Leaders must obey the law.; Government must obey the law. (any one of 4 accepted answers)",
    "source": {
      "url": "https://www.uscis.gov/sites/default/files/document/questions-and-answers/2025-Civics-Test-128-Questions-and-Answers.pdf",
      "section_or_page": "Question 13, page 3"
    },
    "needs_freshness_check": false
  },
  {
    "id": "0a6f8640-fee4-565b-ba0a-8ee391972315",
    "country_iso": "US",
    "topic": "American Government",
    "subtopic": "A: Principles of American Government",
    "language": "en",
    "front": "Many documents influenced the U.S. Constitution. Name one.",
    "back": "Declaration of Independence; Articles of Confederation; Federalist Papers (any one of 8 accepted answers)",
    "source": {
      "url": "https://www.uscis.gov/sites/default/files/document/questions-and-answers/2025-Civics-Test-128-Questions-and-Answers.pdf",
      "section_or_page": "Question 14, page 3"
    },
    "needs_freshness_check": false
  },
  {
    "id": "f6f3ca91-f489-52f1-80c6-2c9ca77d20a9",
    "country_iso": "US",
    "topic": "American Government",
    "subtopic": "A: Principles of American Government",
    "language": "en",
    "front": "There are three branches of government. Why?",
    "back": "So one part does not become too powerful; Checks and balances; Separation of powers",
    "source": {
      "url": "https://www.uscis.gov/sites/default/files/document/questions-and-answers/2025-Civics-Test-128-Questions-and-Answers.pdf",
      "section_or_page": "Question 15, page 3"
    },
    "needs_freshness_check": false
  },
  {
    "id": "682436a0-e853-512f-bcfe-3dc690cc8196",
    "country_iso": "US",
    "topic": "American Government",
    "subtopic": "B: System of Government",
    "language": "en",
    "front": "Name the three branches of government.",
    "back": "Legislative, executive, and judicial; Congress, president, and the courts",
    "source": {
      "url": "https://www.uscis.gov/sites/default/files/document/questions-and-answers/2025-Civics-Test-128-Questions-and-Answers.pdf",
      "section_or_page": "Question 16, page 4"
    },
    "needs_freshness_check": false
  },
  {
    "id": "e7b1feb2-b54c-5088-9e38-fbe9fbce5c22",
    "country_iso": "US",
    "topic": "American Government",
    "subtopic": "B: System of Government",
    "language": "en",
    "front": "The President of the United States is in charge of which branch of government?",
    "back": "Executive branch",
    "source": {
      "url": "https://www.uscis.gov/sites/default/files/document/questions-and-answers/2025-Civics-Test-128-Questions-and-Answers.pdf",